{"verdict":"REVISE","confidence":0.81,"baseline_consistency":true,"used_required_baseline_documents":true,"drift_report_handled":true,"unresolved_doc_code_conflicts":["SDK_PROXY_COMPLIANCE_FAST_PATH_FINAL_SOURCE_DIVERGENCE"],"blocking_issues":[{"id":"FG-001","severity":"high","claim":"The plan leaves a documented SDK/proxy `COMPLIANCE_FAST_PATH` divergence as deferred while acceptance requires semantic equivalence or fully proven non-impact for the target task.","required_fix":"Add an explicit proof obligation and pass/fail test criteria showing the divergence cannot change governance outcome for the canary and stated calling patterns, or include a concrete implementation step to remove the divergence in-scope."},{"id":"FG-002","severity":"high","claim":"The delivery/governance mismatch guard is under-specified (trigger conditions, fallback action, and precedence over existing routes are not fully formalized), making implementation non-deterministic for a fresh agent.","required_fix":"Define exact guard algorithm: inputs, threshold/boolean condition, route/action fallback, metadata fields set, and ordering relative to DCCL fast-path, ledger lookup, and final delivery."},{"id":"FG-003","severity":"medium","claim":"Observability expansion is specified but DB/UI persistence contract is partially deferred/assumed (JSONL minimum plus optional SQLite handling), which risks unverifiable acceptance for UI/trace docs requirements.","required_fix":"State mandatory sink/storage targets for each new field in this patch (JSONL only vs JSONL+SQLite), and align docs acceptance scope accordingly with explicit non-goals and tests."}],"documentation_updates_required":[{"document":"docs/CODEBASE_FACTS.md","required_update":"Record corrected facts about DCCL/speculative history usage and canary behavior post-fix with exact evidence references.","reason":"Prevents stale architectural claims and resolves current [DRIFT] statements."},{"document":"docs/traces/governance_decision_flow.md","required_update":"Add deterministic mismatch-guard flow and precedence points.","reason":"Fresh implementer needs exact execution order to avoid routing regressions."},{"document":"docs/modules/compliance_layer.md","required_update":"Specify DCCL context input contract, truncation policy, and rationale constraints.","reason":"Core behavior change in highest-priority module."},{"document":"docs/modules/server_proxy.md","required_update":"Clarify request transcript authority vs conversation state and reconciliation outcomes.","reason":"Task requires explicit semantics by calling pattern."}],"has_sufficient_tests":true,"has_rollback_strategy":true,"is_implementable_by_fresh_agent":false,"summary":"The plan is strong, baseline-grounded, and close to acceptable, but needs revision to remove ambiguity in the mismatch guard, tighten proof obligations around the remaining SDK/proxy divergence, and make observability persistence scope fully explicit for verification and docs alignment."}
