{"verdict":"ACCEPT","confidence":0.9,"baseline_consistency":true,"used_required_baseline_documents":true,"drift_report_handled":true,"unresolved_doc_code_conflicts":[],"blocking_issues":[],"documentation_updates_required":[{"document":"README.md","required_update":"Document ConversationContext semantics, SDK/proxy multi-turn contracts, and request-transcript authority rules.","reason":"Plan changes externally visible context behavior and must align user-facing guidance."},{"document":"docs/traces/openai_compatible_multiturn.md","required_update":"Update flow to show request messages -> ConversationContext -> module context policy -> final delivery, including state separation and reconciliation semantics.","reason":"Trace currently risks conflating transcript context and governance state."},{"document":"docs/traces/governance_decision_flow.md","required_update":"Add deterministic ordering and behavior of the delivery/governance mismatch guard and compliance fast-path branches.","reason":"Guard placement and downgrade/regenerate behavior are safety-critical."},{"document":"docs/traces/observability_db_to_ui.md","required_update":"Specify mandatory sink targets for new context-shape fields (JSONL + orchestration/proxy event payloads) and explicitly mark UI exposure as deferred if not implemented.","reason":"Prevents overclaiming observability/UI completeness."},{"document":"docs/traces/complai_llm_rules_flow.md","required_update":"Reflect DCCL history-aware behavior after fix and include canary regression evidence expectations.","reason":"This trace is directly tied to the investigated failure mode."},{"document":"docs/CODEBASE_FACTS.md","required_update":"Update verified facts for DCCL/speculative context usage, context-shape observability fields, and documented SDK/proxy fast-path final-text-source divergence constraints.","reason":"Fact ledger must match post-fix runtime behavior."},{"document":"docs/MORALSTACK_CODEBASE_INDEX.md","required_update":"Add/adjust module map entries for shared context builder and mismatch guard integration points.","reason":"Architectural index must remain accurate for future audits."},{"document":"docs/modules/compliance_layer.md","required_update":"Document DCCL prompt/context contract, truncation honesty constraints, and rationale requirements.","reason":"DCCL is the primary corrected module and needs explicit contract docs."},{"document":"docs/modules/server_proxy.md","required_update":"Document request transcript vs conversation_id/state semantics and guarded governed-draft reuse behavior.","reason":"Proxy path currently carries the key divergence and reconciliation logic."}],"has_sufficient_tests":true,"has_rollback_strategy":true,"is_implementable_by_fresh_agent":true,"summary":"The plan is baseline-grounded, resolves the three prior gate blockers (FG-001/002/003) with concrete, testable mechanisms, preserves documented invariants, includes rollback, and is scoped for an implementation pass. Acceptance is conditioned on executing the specified regression suite and delivering the listed documentation updates in the same change."}
